genres,movie_id,original_title,plot,cast
['Comedy'],87567,The Big Wedding,"To the amusement of their adult children and friends, long divorced couple Don and Ellie Griffin are once again forced to play the happy couple for the sake of their adopted son's wedding after his ultra conservative biological mother unexpectedly decides to fly halfway across the world to attend. With all of the wedding guests looking on, the Griffins are hilariously forced to confront their past, present and future - and hopefully avoid killing each other in the process.","['Robert De Niro', 'Diane Keaton', 'Katherine Heigl']"
['Documentary'],174362,Bending Steel,"The Cyclone, The Freakshow, The Mermaid Parade: all Coney Island icons. But Chris “Wonder” Schoeck has always preferred the Coney Island Strongman. Bending Steel follows the sweet, unassuming Schoeck as he parlays his extraordinary strength into the pursuit of his lifelong dream. Training with an elite group of men whose hands bend, drag, twist and shred metal, he tackles an enormous physical and mental challenge, taking a surprisingly emotional journey as a result.",[]
['Drama'],84197,Filly Brown,"“Majo” Tonorio, a.k.a. Filly Brown, is a raw, young Los Angeles hip-hop artist who spits from the heart. When a sleazy record producer offers her a crack at rap stardom, Majo faces some daunting choices. With an incarcerated mother, a record contract could be the ticket out for her struggling family. But taking the deal means selling out her talent and the true friends who helped her to the cusp of success.","['Resmine Atis', 'Baby Bash', 'David Bianchi']"
['Drama'],176124,Home Run,"A pro ball player with a substance abuse problem is forced into rehab in his hometown, finding new hope when he gets honest about his checkered past, and takes on coaching duties for a misfit Little League team","['Scott Elrod', 'Dorian Brown', 'Charles Henry Wyson']"
['Horror'],220490,Her Cry: La Llorona Investigation,"Crew of ""Paranormal Legends"" went to film their 4th season at the place where La Llorona (Weeping woman) was reportedly seen. Only thing that's left was 17 hours of tapes and 2 camcorders.","['Nichole Ceballos', 'James Ezrin', 'Everardo Guzman']"
"['Action', 'Adventure', 'Science Fiction']",68721,Iron Man 3,"When Tony Stark's world is torn apart by a formidable terrorist called the Mandarin, he starts an odyssey of rebuilding and retribution.","['Robert Downey Jr.', 'Gwyneth Paltrow', 'Don Cheadle']"
"['Thriller', 'Crime', 'Action']",134374,Pain & Gain,"Daniel Lugo, manager of the Sun Gym in 1990s Miami, decides that there is only one way to achieve his version of the American dream: extortion. To achieve his goal, he recruits musclemen Paul and Adrian as accomplices. After several failed attempts, they abduct rich businessman Victor Kershaw and convince him to sign over all his assets to them. But when Kershaw makes it out alive, authorities are reluctant to believe his story.","['Mark Wahlberg', 'Dwayne Johnson', 'Anthony Mackie']"
['Drama'],109410,42,"The powerful story of Jackie Robinson, the legendary baseball player who broke Major League Baseball’s color barrier when he joined the roster of the Brooklyn Dodgers. The film follows the innovative Dodgers’ general manager Branch Rickey, the MLB executive who first signed Robinson to the minors and then helped to bring him up to the show.","['Chadwick Boseman', 'T.R. Knight', 'Harrison Ford']"
"['Action', 'Drama', 'Thriller']",192210,Open Road,"Angie, a young Brazilian artist, abandons her old life and embarks on a journey around the country. Running from her past, and searching for her foundation in life, Angie finds not only herself but love in its many forms.","['Camilla Belle', 'Andy García', 'Colin Egglesfield']"
['Comedy'],4258,Scary Movie 5,"Home with their newly-formed family, happy parents Dan and Jody are haunted by sinister, paranormal activities. Determined to expel the insidious force, they install security cameras and discover their family is being stalked by an evil dead demon.","['Simon Rex', 'Ashley Tisdale', 'Charlie Sheen']"
"['Action', 'Science Fiction', 'Adventure']",75612,Oblivion,"Jack Harper is one of the last few drone repairmen stationed on Earth.  Part of a massive operation to extract vital resources after decades of war with a terrifying threat known as the Scavs, Jack’s mission is nearly complete.  His existence is brought crashing down when he rescues a beautiful  stranger from a downed spacecraft.  Her arrival triggers a chain of events that  forces him to question everything he knows and puts the fate of humanity in his hands.","['Tom Cruise', 'Morgan Freeman', 'Olga Kurylenko']"
['Horror'],109428,Evil Dead,"Evil Dead, the fourth installment of the Evil Dead franchise, serving as both a reboot and as a loose continuation of the series, features Mia, a young woman struggling with sobriety, heads to a remote cabin with a group of friends where the discovery of a Book of the Dead unwittingly summon up dormant demons which possess the youngsters one by one.","['Jane Levy', 'Shiloh Fernandez', 'Lou Taylor Pucci']"
"['Romance', 'Drama']",132344,Before Midnight,We meet Jesse and Celine nine years on in Greece. Almost two decades have passed since their first meeting on that train bound for Vienna.,"['Ethan Hawke', 'Julie Delpy', 'Seamus Davey-Fitzpatrick']"
['Drama'],111190,Adore,"Lil and Roz are two lifelong friends, having grown up together as neighbors in an idyllic beach town. As adults, their sons have developed a friendship as strong as that which binds their mothers. One summer, all four are confronted by simmering emotions that have been mounting between them, and each find unexpected happiness in relationships that cross the bounds of convention.","['Naomi Watts', 'Robin Wright', 'Xavier Samuel']"
"['Thriller', 'Crime', 'Drama']",68727,Trance,"A fine art auctioneer mixed up with a gang, joins forces with a hypnotherapist to recover a lost painting. As boundaries between desire, reality and hypnotic suggestion begin to blur, the stakes rise faster than anyone could have anticipated.","['James McAvoy', 'Vincent Cassel', 'Rosario Dawson']"
"['Adventure', 'Action', 'Science Fiction']",72559,G.I. Joe: Retaliation,"Framed for crimes against the country, the G.I. Joe team is terminated by Presidential order. This forces the G.I. Joes into not only fighting their mortal enemy Cobra; they are forced to contend with threats from within the government that jeopardize their very existence.","['Dwayne Johnson', 'D.J. Cotrona', 'Adrianne Palicki']"
"['Action', 'Adventure', 'Romance']",72710,The Host,"A parasitic alien soul is injected into the body of Melanie Stryder. Instead of carrying out her race's mission of taking over the Earth, ""Wanda"" (as she comes to be called) forms a bond with her host and sets out to aid other free humans.","['Saoirse Ronan', 'Diane Kruger', 'Jake Abel']"
"['Comedy', 'Drama', 'Romance']",144340,Admission,"Strait-laced Princeton University admissions officer Portia Nathan is caught off-guard when she makes a recruiting visit to an alternative high school overseen by her former college classmate, the freewheeling John Pressman. Pressman has surmised that Jeremiah, his gifted yet very unconventional student, might well be the son that Portia secretly gave up for adoption many years ago. Soon, Portia finds herself bending the rules for Jeremiah, putting at risk the life she thought she always wanted – but in the process finding her way to a surprising and exhilarating life and romance she never dreamed of having.","['Tina Fey', 'Paul Rudd', 'Michael Sheen']"
"['Adventure', 'Animation', 'Comedy']",49519,The Croods,"The Croods is a prehistoric comedy adventure that follows the world's first family as they embark on a journey of a lifetime when the cave that has always shielded them from danger is destroyed. Traveling across a spectacular landscape, the Croods discover an incredible new world filled with fantastic creatures -- and their outlook is changed forever.","['Nicolas Cage', 'Emma Stone', 'Ryan Reynolds']"
"['Action', 'Thriller']",117263,Olympus Has Fallen,"When the White House (Secret Service Code: ""Olympus"") is captured by a terrorist mastermind and the President is kidnapped, disgraced former Presidential guard Mike Banning finds himself trapped within the building. As the national security team scrambles to respond, they are forced to rely on Banning's inside knowledge to help retake the White House, save the President and avert an even bigger disaster.","['Gerard Butler', 'Aaron Eckhart', 'Angela Bassett']"
"['Drama', 'Crime']",97367,The Place Beyond the Pines,"A motorcycle stunt rider considers committing a crime in order to provide for his wife and child, an act that puts him on a collision course with a cop-turned-politician.","['Ryan Gosling', 'Bradley Cooper', 'Eva Mendes']"
['Comedy'],124459,The Incredible Burt Wonderstone,"After breaking up with his longtime stage partner, a famous but jaded Vegas magician fights for relevance when a new, ""hip"" street magician appears on the scene.","['Steve Carell', 'Jim Carrey', 'Steve Buscemi']"
"['Crime', 'Thriller']",158011,The Call,"Jordan Turner is an experienced 911 operator but when she makes an error in judgment and a call ends badly, Jordan is rattled and unsure if she can continue. But when teenager Casey Welson is abducted in the back of a man's car and calls 911, Jordan is the one called upon to use all of her experience, insights and quick thinking to help Casey escape, and not just to save her, but to make sure the man is brought to justice.","['Halle Berry', 'Abigail Breslin', 'Morris Chestnut']"
['Thriller'],176077,Enter the Dangerous Mind,"A psychological thriller set in the world of underground dubstep, Snap is the story of Jim Whitman, a brilliant but painfully introverted musician who develops a crush on a young social worker.","['Jake Hoffman', 'Nikki Reed', 'Thomas Dekker']"
['Action'],244339,逃出生天,"On the hottest day in 50 years, a serious fire incident happened to a busy commercial tower, a gaggle of fire fighters with an indestructible enthusiasm are going to save lives.","['Lau Ching-Wan', 'Angelica Lee', 'Chen Sicheng']"
"['Thriller', 'Action', 'Crime']",102362,Dead Man Down,"In New York City, a crime lord's right-hand man is seduced by a woman seeking retribution.","['Colin Farrell', 'Noomi Rapace', 'Terrence Howard']"
"['Drama', 'Comedy', 'Crime']",175291,Cheap Thrills,"Recently fired and facing eviction, a new dad has his life turned upside down when he meets a wealthy couple who offer a path to financial security... but at a price.","['Pat Healy', 'Ethan Embry', 'Sara Paxton']"
"['Fantasy', 'Adventure', 'Family']",68728,Oz: The Great and Powerful,"Oscar Diggs, a small-time circus illusionist and con-artist, is whisked from Kansas to the Land of Oz where the inhabitants assume he's the great wizard of prophecy, there to save Oz from the clutches of evil.","['James Franco', 'Mila Kunis', 'Rachel Weisz']"
['Comedy'],107811,21 & Over,"Brilliant student Jeff Chang has the most important interview of his life tomorrow.  But today is still his birthday, what starts off as a casual celebration with friends evolves into a night of debauchery that risks to derail his life plan.","['Miles Teller', 'Skylar Astin', 'Justin Chon']"
"['Adventure', 'Family']",171759,The Lost Medallion: The Adventures of Billy Stone,A man who stops into a foster home to drop off some donations soon tells the kids a story about two teenage friends who uncover a long-lost medallion that transports them back in time.,"['William Brent', 'Sammi Hanratty', 'James Hong']"
"['Horror', 'Drama']",308467,Roadside,"Dan Summers and his pregnant wife, Mindy, fight for their lives when they are held hostage in their car by an unseen gunman on the side of a desolate mountain road.","['Ace Marrero', 'Katie Stegeman']"
"['Drama', 'Horror', 'Thriller']",86825,Stoker,"After India's father dies, her Uncle Charlie, who she never knew existed, comes to live with her and her unstable mother. She comes to suspect this mysterious, charming man has ulterior motives and becomes increasingly infatuated with him.","['Mia Wasikowska', 'Nicole Kidman', 'Matthew Goode']"
"['Horror', 'Thriller']",146203,The Last Exorcism Part II,"As Nell Sweetzer tries to build a new life after the events of the first movie, the evil force that once possessed her returns with an even more horrific plan.","['Ashley Bell', 'Julia Garner', 'Andrew Sensenig']"
"['Romance', 'Comedy', 'Music']",173224,Along the Roadside,"Road movie about two young people from different parts of the world, their vastly different clashing cultures and their journey of self-discovery during the drive to the largest music festival in California.","['Michael Madsen', 'Iman Crosson', 'Lazar Ristovski']"
"['Action', 'Family', 'Fantasy']",81005,Jack the Giant Slayer,"The story of an ancient war that is reignited when a young farmhand unwittingly opens a gateway between our world and a fearsome race of giants. Unleashed on the Earth for the first time in centuries, the giants strive to reclaim the land they once lost, forcing the young man, Jack into the battle of his life to stop them. Fighting for a kingdom, its people, and the love of a brave princess, he comes face to face with the unstoppable warriors he thought only existed in legend–and gets the chance to become a legend himself.","['Nicholas Hoult', 'Eleanor Tomlinson', 'Ewan McGregor']"
"['Drama', 'Science Fiction']",110402,Трудно быть богом,"A group of scientists is sent to the planet Arkanar to help the local civilization, which is in the Medieval phase of its own history, to find the right path to progress. Their task is a difficult one: they cannot interfere violently and in no case can they kill. The scientist Rumata tries to save the local intellectuals from their punishment and cannot avoid taking a position. As if the question were: what would you do in God's place? Director's statement Aleksei wanted to make this film his entire life. The road was a long one. This is not a film about cruelty, but about love. A love that was there, tangible, alive, and that resisted through the hardest of conditions.","['Leonid Yarmolnik', 'Yuriy Tsurilo', 'Natalya Moteva']"
"['Thriller', 'Drama']",134411,Snitch,"Construction company owner John Matthews learns that his estranged son, Jason, has been arrested for drug trafficking. Facing an unjust prison sentence for a first time offender courtesy of mandatory minimum sentence laws, Jason has nothing to offer for leniency in good conscience. Desperately, John convinces the DEA and the opportunistic DA Joanne Keeghan to let him go undercover to help make arrests big enough to free his son in return. With the unwitting help of an ex-con employee, John enters the narcotics underworld where every move could be his last in an operation that will demand all his resources, wits and courage to survive.","['Dwayne Johnson', 'Barry Pepper', 'Jon Bernthal']"
['Documentary'],178862,Aroused,"Get up close and personal with 16 of the most successful women in the adult film industry as they shed their clothes for an intimate photo shoot with director Deborah Anderson. As questions are asked, personal stories about their lives are revealed, from why they chose the business of sex to how they got into it in the first place. These porn stars have always been discreet about their private lives in the past, yet Anderson has a way of opening up a dialog allowing them to share more than just their naked skin on screen. Their true inner vulnerability is touching, yet the characters they have created are confident and intoxicating. Once you hear their stories, you'll never look at them in the same way again.","['Lisa Ann', 'Kayden Kross', 'Belladonna']"
"['Horror', 'Comedy']",165864,Hansel and Gretel Get Baked,"An intense new marijuana strain named “Black Forest” is taking Los Angeles by storm, and Gretel’s stoner boyfriend can’t get enough. But when the old woman growing the popular drug (Lara Flynn Boyle) turns out to be an evil witch, cooking and eating her wasted patrons for their youth, Gretel and her brother Hansel must save him from a gruesome death — or face the last high of their lives.","['Molly C. Quinn', 'Michael Welch', 'Lara Flynn Boyle']"
"['Animation', 'Comedy', 'Adventure']",68179,Escape from Planet Earth,Astronaut Scorch Supernova finds himself caught in a trap when he responds to an SOS from a notoriously dangerous alien planet.,"['Brendan Fraser', 'Rob Corddry', 'Ricky Gervais']"
"['Comedy', 'Romance']",255266,Dry Spell,Sasha tries to get her soon-to-be ex husband Kyle laid so she can move on with her sex life guilt-free.,"['Suzi Lorraine', 'Jared Degado', 'Heather Dorff']"
"['Fantasy', 'Drama', 'Romance']",109491,Beautiful Creatures,"Ethan Wate just wants to get to know Lena Duchannes better, but unbeknownst to him, Lena has strange powers.  As Lena's 16th birthday approaches she might decide her fate, to be good or evil.  A choice which will impact her relationship forever.","['Alden Ehrenreich', 'Alice Englert', 'Jeremy Irons']"
"['Comedy', 'Crime']",109431,Identity Thief,"When a mild-mannered businessman learns his identity has been stolen, he hits the road in an attempt to foil the thief -- a trip that puts him in the path of a deceptively harmless-looking woman.","['Jason Bateman', 'Melissa McCarthy', 'Jon Favreau']"
"['Thriller', 'Crime', 'Drama']",109421,Side Effects,A woman turns to prescription medication as a way of handling her anxiety concerning her husband's upcoming release from prison.,"['Jude Law', 'Rooney Mara', 'Catherine Zeta-Jones']"
['Romance'],112949,Safe Haven,"A young woman with a mysterious past lands in Southport, North Carolina where her bond with a widower forces her to confront the dark secret that haunts her.","['Julianne Hough', 'Josh Duhamel', 'Cobie Smulders']"
"['Drama', 'Music']",157293,एबीसीडी,"When a capable dancer is provoked by the evil design of his employer, naturally he will be out to prove his mettle.","['Prabhu Deva', 'Ganesh Acharya', 'Kay Kay Menon']"
"['Action', 'Thriller']",47964,A Good Day to Die Hard,"Iconoclastic, take-no-prisoners cop John McClane, finds himself for the first time on foreign soil after traveling to Moscow to help his wayward son Jack - unaware that Jack is really a highly-trained CIA operative out to stop a nuclear weapons heist. With the Russian underworld in pursuit, and battling a countdown to war, the two McClanes discover that their opposing methods make them unstoppable heroes.","['Bruce Willis', 'Jai Courtney', 'Sebastian Koch']"
"['Horror', 'Drama', 'Thriller']",150202,The Haunting in Connecticut 2: Ghosts of Georgia,Sequel to the 2009 mezzo-mezzo supernatural horror purporting to be based on a true story in which a cancer-afflicted teen starts seeing things in the new Victorian house he and his family moved into.,"['Chad Michael Murray', 'Katee Sackhoff', 'Abigail Spencer']"
[],320435,UnDivided,"UnDivided documents the true story of how a suburban church unites with at-risk Roosevelt High School to create a beautiful transformation for students, the school and the volunteers serving it.",[]
"['Action', 'Crime', 'Thriller']",70074,Bullet to the Head,"After watching their respective partners die, a cop and a hitman form an alliance in order to bring down their common enemy.","['Sylvester Stallone', 'Sung Kang', 'Sarah Shahi']"
"['Horror', 'Comedy', 'Romance']",82654,Warm Bodies,"After a zombie becomes involved with the girlfriend of one of his victims, their romance sets in motion a sequence of events that might transform the entire lifeless world.","['Nicholas Hoult', 'Teresa Palmer', 'Analeigh Tipton']"
"['Drama', 'Crime']",122081,Spring Breakers,"After four college girls rob a restaurant to fund their spring break in Florida, they get entangled with a weird dude with his own criminal agenda.","['James Franco', 'Selena Gomez', 'Vanessa Hudgens']"
"['Action', 'Crime']",119283,Parker,"A thief with a unique code of professional ethics is double-crossed by his crew and left for dead. Assuming a new disguise and forming an unlikely alliance with a woman on the inside, he looks to hijack the score of the crew's latest heist.","['Jason Statham', 'Jennifer Lopez', 'Nick Nolte']"
"['Thriller', 'Crime', 'Drama']",98357,Broken City,"In a broken city rife with injustice, ex-cop Billy Taggart seeks redemption and revenge after being double-crossed and then framed by its most powerful figure, the mayor. Billy's relentless pursuit of justice, matched only by his streetwise toughness, makes him an unstoppable force - and the mayor's worst nightmare.","['Mark Wahlberg', 'Russell Crowe', 'Catherine Zeta-Jones']"
"['Action', 'Animation']",142061,"Batman: The Dark Knight Returns, Part 2",Batman has stopped the reign of terror that The Mutants had cast upon his city.  Now an old foe wants a reunion and the government wants The Man of Steel to put a stop to Batman.,"['Peter Weller', 'Ariel Winter', 'David Selby']"
"['Fantasy', 'Horror', 'Action']",60304,Hansel & Gretel: Witch Hunters,"After getting a taste for blood as children, Hansel and Gretel have become the ultimate vigilantes, hell-bent on retribution. Now, unbeknownst to them, Hansel and Gretel have become the hunted, and must face an evil far greater than witches... their past.","['Jeremy Renner', 'Gemma Arterton', 'Famke Janssen']"
['Horror'],132232,Mama,"Guillermo del Toro presents Mama, a supernatural thriller that tells the haunting tale of two little girls who disappeared into the woods the day that their parents were killed. When they are rescued years later and begin a new life, they find that someone or something still wants to come tuck them in at night.","['Jessica Chastain', 'Nikolaj Coster-Waldau', 'Megan Charpentier']"
"['Comedy', 'Drama']",153795,Straight A's,"Pressured by his deceased mother's ghost to return home to the family he abandoned, a former addict grabs a bag of pills and a sack of marijuana and hits the road to Shreveport.","['Anna Paquin', 'Ryan Phillippe', 'Luke Wilson']"
['Comedy'],157058,30 Nights of Paranormal Activity With the Devil Inside the Girl With the Dragon Tattoo,"After a stint in a psychiatric hospital, a young woman returns to the house where her father killed the entire cast of The Artist during his exorcism.","['Kathryn Fiore', 'Flip Schultz', 'Olivia Alexander']"
"['Action', 'Crime', 'Thriller']",76640,The Last Stand,"Ray Owens is sheriff of the quiet US border town of Sommerton Junction after leaving the LAPD following a bungled operation. Following his escape from the FBI, a notorious drug baron, his gang, and a hostage are heading toward Sommerton Junction where the police are preparing to make a last stand to intercept them before they cross the border. Owens is reluctant to become involved but ultimately joins in with the law enforcement efforts","['Arnold Schwarzenegger', 'Forest Whitaker', 'Rodrigo Santoro']"
"['Comedy', 'Horror']",139038,A Haunted House,"A spoof of all the ""found-footage/documentary style"" films released in recent years.","['Marlon Wayans', 'Essence Atkins', 'Nick Swardson']"
"['Crime', 'Drama', 'Action']",82682,Gangster Squad,"Los Angeles, 1949. Ruthless, Brooklyn-born mob king Mickey Cohen runs the show in this town, reaping the ill-gotten gains from the drugs, the guns, the prostitutes and — if he has his way — every wire bet placed west of Chicago. And he does it all with the protection of not only his own paid goons, but also the police and the politicians who are under his control. It’s enough to intimidate even the bravest, street-hardened cop… except, perhaps, for the small, secret crew of LAPD outsiders led by Sgt. John O’Mara and Jerry Wooters who come together to try to tear Cohen’s world apart.","['Josh Brolin', 'Ryan Gosling', 'Nick Nolte']"
"['Action', 'Drama', 'History']",44865,一代宗師,"Ip Man's peaceful life in Foshan changes after Gong Yutian seeks an heir for his family in Southern China. Ip Man then meets Gong Er who challenges him for the sake of regaining her family's honor. After the Second Sino-Japanese War, Ip Man moves to Hong Kong and struggles to provide for his family. In the mean time, Gong Er chooses the path of vengeance after her father was killed by Ma San.","['Tony Leung Chiu-Wai', 'Zhang Ziyi', 'Song Hye-kyo']"
"['Horror', 'Thriller']",76617,Texas Chainsaw 3D,"A young woman learns that she has inherited a Texas estate from her deceased grandmother. After embarking on a road trip with friends to uncover her roots, she finds she is the sole owner of a lavish, isolated Victorian mansion. But her newfound wealth comes at a price as she stumbles upon a horror that awaits her in the mansion’s dank cellars.","['Alexandra Daddario', 'Dan Yeager', 'Bill Moseley']"
"['Drama', 'Romance', 'Crime']",152742,La migliore offerta,"Virgil Oldman is a world renowned antiques expert and auctioneer. An eccentric genius, he leads a solitary life, going to extreme lengths to keep his distance from the messiness of human relationships. When appointed by the beautiful but emotionally damaged Claire to oversee the valuation and sale of her family’s priceless art collection, Virgil allows himself to form an attachment to her – and soon he is engulfed by a passion which will rock his bland existence to the core.","['Geoffrey Rush', 'Jim Sturgess', 'Sylvia Hoeks']"
