genres,movie_id,original_title,plot,cast
"['Action', 'Drama', 'Thriller']",192102,3 Days to Kill,"A dangerous international spy is determined to give up his high stakes life to finally build a closer relationship with his estranged wife and daughter. But first, he must complete one last mission - even if it means juggling the two toughest assignments yet: hunting down the world's most ruthless terrorist and looking after his teenage daughter for the first time in ten years, while his wife is out of town.","['Kevin Costner', 'Amber Heard', 'Hailee Steinfeld']"
"['Comedy', 'Romance']",222899,About Last Night,"A modern reimagining of the classic romantic comedy, this contemporary version closely follows new love for two couples as they journey from the bar to the bedroom and are eventually put to the test in the real world.","['Kevin Hart', 'Michael Ealy', 'Regina Hall']"
"['Drama', 'Fantasy', 'Mystery']",137321,Winter's Tale,"A burglar falls for an heiress as she dies in his arms. When he learns that he has the gift of reincarnation, he sets out to save her.","['Colin Farrell', 'Jessica Brown Findlay', 'Russell Crowe']"
"['Drama', 'Romance']",226857,Endless Love,A privileged girl and a charismatic boy's instant desire sparks a love affair made only more reckless by parents trying to keep them apart.,"['Alex Pettyfer', 'Gabriella Wilde', 'Robert Patrick']"
['Drama'],251321,Aloft,"As we follow a mother and her son, we delve into a past marred by an accident that tears them apart. She will become a renowned artist and healer, and he will grow into his own and a peculiar falconer who bears the marks of a double absence. In the present, a young journalist will bring about an encounter between the two that puts the very meaning of life and art into question, so that we may contemplate the possibility of living life to its fullest, despite the uncertainties littering our paths.","['Jennifer Connelly', 'Mélanie Laurent', 'Cillian Murphy']"
"['Animation', 'Adventure', 'Family']",82703,Mr. Peabody & Sherman,"A young boy and his dog, who happens to have a genius-level IQ, spring into action when their time-travel machine is stolen and moments in history begin to be changed.","['Ty Burrell', 'Max Charles', 'Ariel Winter']"
"['Adventure', 'Animation', 'Comedy']",137106,The Lego Movie,"An ordinary Lego mini-figure, mistakenly thought to be the extraordinary MasterBuilder, is recruited to join a quest to stop an evil Lego tyrant from gluing the universe together.","['Chris Pratt', 'Will Ferrell', 'Elizabeth Banks']"
"['Action', 'Science Fiction']",97020,RoboCop,"In RoboCop, the year is 2028 and multinational conglomerate OmniCorp is at the center of robot technology.  Overseas, their drones have been used by the military for years, but have been forbidden for law enforcement in America.  Now OmniCorp wants to bring their controversial technology to the home front, and they see a golden opportunity to do it.  When Alex Murphy – a loving husband, father and good cop doing his best to stem the tide of crime and corruption in Detroit – is critically injured, OmniCorp sees their chance to build a part-man, part-robot police officer.  OmniCorp envisions a RoboCop in every city and even more billions for their shareholders, but they never counted on one thing: there is still a man inside the machine.","['Joel Kinnaman', 'Gary Oldman', 'Michael Keaton']"
"['Thriller', 'Adventure', 'Mystery']",208763,Viy,"Early 18th century. Cartographer Jonathan Green undertakes a scientific voyage from Europe to the East. Having passed through Transylvania and crossed the Carpathian Mountains, he finds himself in a small village lost in impassible woods. Nothing but chance and heavy fog could bring him to this cursed place. People who live here do not resemble any other people which the traveler saw before that. The villagers, having dug a deep moat to fend themselves from the rest of the world, share a naive belief that they could save themselves from evil, failing to understand that evil has made its nest in their souls and is waiting for an opportunity to gush out upon the world.","['Jason Flemyng', 'Aleksey Chadov', 'Agniya Ditkovskite']"
"['Comedy', 'Romance']",225565,That Awkward Moment,"Best pals Jason and Daniel indulge in casual flings and revel in their carefree, unattached lives. After learning that the marriage of their friend Mikey is over, they gladly welcome him back into their circle. The three young men make a pact to have fun and avoid commitment. However, when all three find themselves involved in serious relationships, they must keep their romances secret from one another.","['Zac Efron', 'Miles Teller', 'Michael B. Jordan']"
"['Action', 'Thriller', 'Mystery']",225574,Non-Stop,"Bill Marks is a burned-out veteran of the Air Marshals service. He views the assignment not as a life-saving duty, but as a desk job in the sky. However, today's flight will be no routine trip. Shortly into the transatlantic journey from New York to London, he receives a series of mysterious text messages ordering him to have the government transfer $150 million into a secret account, or a passenger will die every 20 minutes.","['Liam Neeson', 'Julianne Moore', 'Scoot McNairy']"
"['War', 'Drama', 'History']",152760,The Monuments Men,"Based on the true story of the greatest treasure hunt in history, The Monuments Men is an action drama focusing on seven over-the-hill, out-of-shape museum directors, artists, architects, curators, and art historians who went to the front lines of WWII to rescue the world’s artistic masterpieces from Nazi thieves and return them to their rightful owners.  With the art hidden behind enemy lines, how could these guys hope to succeed?","['Matt Damon', 'Cate Blanchett', 'George Clooney']"
['Animation'],239897,Dwegons,"Family inherits an old house and to their surprise, finds the home filled with wonderful colorful creatures that brings the family together.","['Melissa Leo', 'Maggie Wheeler', 'Joey D. Vieira']"
"['Horror', 'Thriller']",100241,"I, Frankenstein","200 years after his shocking creation, Dr. Frankenstein's creature, Adam, still walks the earth. But when he finds himself in the middle of a war over the fate of humanity, Adam discovers he holds the key that could destroy humankind.","['Aaron Eckhart', 'Yvonne Strahovski', 'Bill Nighy']"
"['Drama', 'Comedy']",242083,Hits,"A talentless teen will do anything to get on TV's ""The Voice."" Meanwhile, her father, a municipal worker, creates an uproar when a video of his rants at City Hall goes viral.","['Meredith Hagner', 'Matt Walsh', 'James Adomian']"
['Drama'],244783,Song One,"Estranged from her family, Franny returns home when an accident leaves her brother comatose. Retracing his life as an aspiring musician, she tracks down his favorite musician, James Forester. Against the backdrop of Brooklyn’s music scene, Franny and James develop an unexpected relationship and face the realities of their lives.","['Anne Hathaway', 'Johnny Flynn', 'Mary Steenburgen']"
['Drama'],244776,The Sleepwalker,"A young couple, Kaia and Andrew, are renovating Kaia's secluded family estate. Their lives are violently interrupted when unexpected guests arrive. The Sleepwalker chronicles the unraveling of the lives of four disparate characters as it transcends genre conventions and narrative contrivance to reveal something much more disturbing.","['Christopher Abbott', 'Brady Corbet', 'Stephanie Ellis']"
"['Drama', 'Comedy']",231576,Wish I Was Here,"Aidan Bloom, a struggling actor, father and husband, is 35 years old and still trying to find a purpose for his life. He and his wife are barely getting by financially and Aidan passes his time by fantasizing about being the great futuristic Space-Knight he'd always dreamed he'd be as a little kid. When his ailing father can no longer afford to pay for private school for his two kids and the only available public school is on its last legs, Aidan reluctantly agrees to attempt to home-school them. Through teaching them about life his way, Aidan gradually discovers some of the parts of himself he couldn't find.","['Zach Braff', 'Kate Hudson', 'Joey King']"
['Drama'],244772,The Skeleton Twins,"Estranged twins Maggie and Milo coincidentally cheat death on the same day, prompting them to reunite and confront the reasons their lives went so wrong. As the twins' reunion reinvigorates them, they realize the key to fixing their lives may just lie in repairing their relationship.","['Kristen Wiig', 'Bill Hader', 'Luke Wilson']"
"['Animation', 'Comedy', 'Family']",227783,The Nut Job,"Surly, a curmudgeon, independent squirrel is banished from his park and forced to survive in the city. Lucky for him, he stumbles on the one thing that may be able to save his life, and the rest of park community, as they gear up for winter - Maury's Nut Store.","['Will Arnett', 'Katherine Heigl', 'Brendan Fraser']"
"['Action', 'Drama', 'Thriller']",137094,Jack Ryan: Shadow Recruit,"Jack Ryan, as a young covert CIA analyst, uncovers a Russian plot to crash the U.S. economy with a terrorist attack.","['Chris Pine', 'Keira Knightley', 'Kevin Costner']"
"['Thriller', 'Horror']",280381,House at the End of the Drive,"When David King purchases a house in the hills far above the angst of Los Angeles, he gets much more than he bargained for when strange and unexplainable occurrences in and around the house begin to take control of his daily life","['James Oliver', 'Jonathan Mangum', 'Alison Raimondi']"
"['Action', 'Adventure']",188207,The Legend of Hercules,"In Ancient Greece 1200 B.C., a queen succumbs to the lust of Zeus to bear a son promised to overthrow the tyrannical rule of the king and restore peace to a land in hardship. But this prince, Hercules, knows nothing of his real identity or his destiny. He desires only one thing: the love of Hebe, Princess of Crete, who has been promised to his own brother. When Hercules learns of his greater purpose, he must choose: to flee with his true love or to fulfill his destiny and become the true hero of his time. The story behind one of the greatest myths is revealed in this action-packed epic - a tale of love, sacrifice and the strength of the human spirit.","['Kellan Lutz', 'Liam McIntyre', 'Gaia Weiss']"
['Horror'],79316,Devil's Due,An unexpected pregnancy takes a terrifying turn for newlyweds Zach and Samantha McCall.,"['Allison Miller', 'Zach Gilford', 'Sam Anderson']"
"['Action', 'Comedy']",168530,Ride Along,"For the past two years, high-school security guard Ben has been trying to show decorated APD detective James that he's more than just a video-game junkie who's unworthy of James' sister, Angela. When Ben finally gets accepted into the academy, he thinks he's earned the seasoned policeman's respect and asks for his blessing to marry Angela. Knowing that a ride along will demonstrate if Ben has what it takes to take care of his sister, James invites him on a shift designed to scare the hell out of the trainee. But when the wild night leads them to the most notorious criminal in the city, James will find that his new partner's rapid-fire mouth is just as dangerous as the bullets speeding at it.","['Ice Cube', 'Kevin Hart', 'John Leguizamo']"
"['Crime', 'Mystery', 'Thriller']",241766,Lords of London,"Tony is a notorious gangster with a big problem. He has woken up in an abandoned farmhouse, with blood on his shirt, and no memory of how he got there. He stumbles into a small town and discovers he’s in an Italian village that seems to be lost in time.","['Glen Murphy', 'Ray Winstone', 'Giovanni Capalbo']"
"['Horror', 'Thriller']",227348,Paranormal Activity: The Marked Ones,"Seventeen-year-old Jesse has been hearing terrifying sounds coming from his neighbor’s apartment, but when he turns on his camera and sets out to uncover their source, he encounters an ancient evil that won’t rest until it’s claimed his very soul.","['Andrew Jacobs', 'Richard Cabral', 'Carlos Pratts']"
"['War', 'Drama', 'History']",281230,Fort McCoy,"Unable to serve in World War II because of a heart condition, a barber moves his family adjacent to a Wisconsin army base and prisoner-of-war camp to provide his services. But even in rural America -- far from the frontline -- the war finds victims.","['Eric Stoltz', 'Kate Connor', 'Lyndsy Fonseca']"
[],331493,Light from the Darkroom,Light in the Darkroom is the story of two best friends whose faith is tested when their friends disappear during a religious pilgrimage.,[]
['Drama'],215918,1982,"1982, a film inspired by true events at the onset of the crack epidemic in Philadelphia, tells the story of a father and his efforts to protect his gifted daughter from the insidious epidemic which has literally come home via her drug-addicted mother. As his wife becomes more distant and unreliable, he struggles to raise his daughter on his own, while still striving to help his wife become clean. In the process, he learns some hard truths about his marriage and his life, which will ultimately test him as a parent, a husband, and a man","['Bokeem Woodbine', 'Sharon Leal', 'Wayne Brady']"
"['Adventure', 'Family']",246449,Against the Wild,"The action-packed feature film tells the dramatic tale of two siblings and their Alaskan Malamute, who must make an emergency landing when their small plane has engine problems. They find themselves in a beautiful but potentially dangerous natural environment that they must overcome together.","['Natasha Henstridge', 'CJ Adams', 'Erin Pitt']"
['Drama'],130150,Labor Day,"Depressed single mom Adele and her son Henry offer a wounded, fearsome man a ride. As police search town for the escaped convict, the mother and son gradually learn his true story as their options become increasingly limited.","['Josh Brolin', 'Kate Winslet', 'Gattlin Griffith']"
"['Action', 'Adventure', 'Drama']",252360,In the Name of the King III,"Hazen Kaine, an American contract killer living in Sofia, Bulgaria, gets more than he bargains for when he enters into a contract with the mob. One last job before he gets out and starts a new life for himself. The targets: the three children of royal billionaire Andon Dupont. Seems simple enough, or so he thought. Hazen apprehends the children, and before he can blink an eye, a simple necklace worn by one of the children sends his life spiraling back to medieval times. Now completely out of his element, Hazen fights for his life as he tries to escape a medieval army and a fierce fire-breathing dragon.","['Dominic Purcell', 'Ralitsa Paskaleva', 'Bashar Rahal']"
"['Comedy', 'Drama']",152737,August: Osage County,"A look at the lives of the strong-willed women of the Weston family, whose paths have diverged until a family crisis brings them back to the Midwest house they grew up in, and to the dysfunctional woman who raised them.","['Meryl Streep', 'Julia Roberts', 'Chris Cooper']"
"['Drama', 'History']",127560,The Railway Man,"A victim from World War II's ""Death Railway"" sets out to find those responsible for his torture. A true story.","['Jeremy Irvine', 'Colin Firth', 'Stellan Skarsgård']"
"['Crime', 'Drama', 'Comedy']",106646,The Wolf of Wall Street,"A New York stockbroker refuses to cooperate in a large securities fraud case involving corruption on Wall Street, corporate banking world and mob infiltration. Based on Jordan Belfort's autobiography.","['Leonardo DiCaprio', 'Jonah Hill', 'Margot Robbie']"
['Comedy'],64807,Grudge Match,A pair of aging boxing rivals are coaxed out of retirement to fight one final bout -- 30 years after their last match.,"['Robert De Niro', 'Sylvester Stallone', 'Alan Arkin']"
"['Action', 'Drama', 'Thriller']",193756,Lone Survivor,"Based on the failed June 28, 2005 mission ""Operation Red Wing."" Four members of SEAL Team 10, were tasked with the mission to capture or kill notorious Taliban leader, Ahmad Shah. Only one member of the team survived.","['Mark Wahlberg', 'Taylor Kitsch', 'Emile Hirsch']"
"['Family', 'Fantasy', 'Animation']",202575,The House of Magic,"Thunder, an abandoned young cat seeking shelter from a storm, stumbles into the strangest house imaginable, owned by an old magician and inhabited by a dazzling array of automatons and gizmos. Not everyone welcomes the new addition to the troupe as Jack Rabbit and Maggie Mouse plot to evict Thunder. The situation gets worse when the magician lands in hospital and his scheming nephew sees his chance to cash in by selling the mansion. Our young hero is determined to earn his place and so he enlists the help of some wacky magician's assistants to protect his magical new home.","['Brianne Siddall', 'Joey Camen', 'Elisa Gabrielli']"
"['Adventure', 'Comedy', 'Drama']",116745,The Secret Life of Walter Mitty,A timid magazine photo manager who lives life vicariously through daydreams embarks on a true-life adventure when a negative goes missing.,"['Ben Stiller', 'Kristen Wiig', 'Patton Oswalt']"
"['Animation', 'Family', 'Adventure']",77951,Walking With Dinosaurs,"Walking with Dinosaurs 3D is a film depicting life-like 3D dinosaur characters set in photo-real landscapes that transports audiences to the prehistoric world as it existed 70 million years ago. The film is based on the 1999 documentary television miniseries Walking with Dinosaurs, produced by the BBC. Walking with Dinosaurs 3D is being produced by Evergreen Studios, the company that produced Happy Feet, and it is was released on October 11, 2013.","['Charlie Rowe', 'Justin Long', 'Karl Urban']"
['Comedy'],109443,Anchorman 2: The Legend Continues,"With the 70s behind him, San Diego's top rated newsman, Ron Burgundy, returns to take New York's first 24-hour news channel by storm.","['Will Ferrell', 'Steve Carell', 'Paul Rudd']"
"['Romance', 'Science Fiction', 'Drama']",152601,Her,"In the not so distant future, Theodore, a lonely writer purchases a newly developed operating system designed to meet the user's every needs. To Theordore's surprise, a romantic relationship develops between him and his operating system. This unconventional love story blends science fiction and romance in a sweet tale that explores the nature of love and the ways that technology isolates and connects us all.","['Joaquin Phoenix', 'Scarlett Johansson', 'Rooney Mara']"
"['Comedy', 'Drama']",175555,A Madea Christmas,Madea dispenses her unique form of holiday spirit on rural town when she's coaxed into helping a friend pay her daughter a surprise visit in the country for Christmas.,"['Tyler Perry', 'Anna Maria Horsford', 'Tika Sumpter']"
"['Drama', 'Crime']",168672,American Hustle,"A con man, Irving Rosenfeld, along with his seductive partner Sydney Prosser, is forced to work for a wild FBI agent, Richie DiMaso, who pushes them into a world of Jersey powerbrokers and mafia.","['Christian Bale', 'Bradley Cooper', 'Amy Adams']"
"['Action', 'Crime']",244114,風暴,"A crew of seasoned criminals led by the notorious Nam, armed with high-powered weapons, pulls off another smooth and violent armored car heist in broad daylight in a crowded street. Whoever tries to get in their way, they will show no mercy. This puts the police force to shame and humiliation. A hardboiled senior police inspector Lui, hot on the trails of Nam and his tight crew, determines to put an end to this madness that causes the lives of innocent people. But he soon comes face to face with the cruel reality that the usual police tactics are too futile to send these armed thieves behind bars. Extreme crime requires extreme justice, even if it means crossing his moral line. Tou, an ex-con desperate to leave his criminal past behind, volunteers to be Lui’s snitch in exchange for a fresh start with her girlfriend Bing. But little does he know what hellish situation he’s getting himself into.","['Andy Lau', 'Gordon Lam Ka-Tung', 'Yao Chen']"
"['Adventure', 'Fantasy']",57158,The Hobbit: The Desolation of Smaug,"The Dwarves, Bilbo and Gandalf have successfully escaped the Misty Mountains, and Bilbo has gained the One Ring. They all continue their journey to get their gold back from the Dragon, Smaug.","['Martin Freeman', 'Ian McKellen', 'Richard Armitage']"
"['Drama', 'Action', 'Adventure']",64686,47 Ronin,"Based on the original 1941 movie from Japan, and from ancient Japan’s most enduring tale, the epic 3D fantasy-adventure 47 Ronin is born.  Keanu Reeves leads the cast as Kai, an outcast who joins Oishi (Hiroyuki Sanada), the leader of the 47 outcast samurai.  Together they seek vengeance upon the treacherous overlord who killed their master and banished their kind.  To restore honor to their homeland, the warriors embark upon a quest that challenges them with a series of trials that would destroy ordinary warriors.","['Keanu Reeves', 'Hiroyuki Sanada', 'Kou Shibasaki']"
"['Drama', 'History']",192136,Mandela: Long Walk to Freedom,A chronicle of Nelson Mandela's life journey from his childhood in a rural village through to his inauguration as the first democratically elected president of South Africa.,"['Idris Elba', 'Naomie Harris', 'Tony Kgoroge']"
"['Thriller', 'Drama', 'Crime']",164457,Out of the Furnace,"Two brothers live in the economically-depressed Rust Belt, when a cruel twist of fate lands one in prison. His brother is then lured into one of the most violent crime rings in the Northeast.","['Christian Bale', 'Zoe Saldana', 'Woody Harrelson']"
"['Fantasy', 'Adventure', 'Family']",227707,The Adventurer: The Curse of the Midas Box,"17-year-old Mariah Mundi's life is turned upside down when his parents vanish and his younger brother is kidnapped. Following a trail of clues to the darkly majestic Prince Regent Hotel, Mariah discovers a hidden realm of child-stealing monsters, deadly secrets and a long-lost artifact that grants limitless wealth – but also devastating supernatural power. With the fate of his world, and his family at stake, Mariah will risk everything to unravel the Curse of the Midas Box.","['Aneurin Barnard', 'Michael Sheen', 'Lena Headey']"
"['Action', 'Thriller', 'War']",299552,Born Of War,"Mina, a young college student, has her life ripped away after her family is killed. When she finds out their murder was part of a botched kidnapping to return her to her real father—a terrorist in the middle east.","['James Frain', ""Sofia Black-D'Elia"", 'Lydia Leonard']"
"['Crime', 'Drama', 'Thriller']",185567,Zulu,"As a child, Ali Neuman narrowly escaped being murdered by Inkhata, a militant political party at war with Nelson Mandela's African National Congress. Only he and his mother survived the carnage of those years. But as with many survivors, the psychological scars remain.","['Orlando Bloom', 'Forest Whitaker', 'Conrad Kemp']"
"['Comedy', 'Drama']",137347,Closer to the Moon,A Romanian police officer teams up with a small crew of bank robbers to pull off a heist by convincing everyone at the scene of the crime that they are only filming a movie.,"['Vera Farmiga', 'Mark Strong', 'Harry Lloyd']"
"['Animation', 'Adventure', 'Family']",109445,Frozen,"Young princess Anna of Arendelle dreams about finding true love at her sister Elsa’s coronation. Fate takes her on a dangerous journey in an attempt to end the eternal winter that has fallen over the kingdom. She's accompanied by ice delivery man Kristoff, his reindeer Sven, and snowman Olaf. On an adventure where she will find out what friendship, courage, family, and true love really means.","['Kristen Bell', 'Idina Menzel', 'Jonathan Groff']"
"['Action', 'Thriller']",204082,Homefront,"Phil Broker is a former DEA agent who has gone through a crisis after his action against a biker gang went horribly wrong and it cost the life of his boss' son. He is recently widowed and is left with a 9-years-old daughter,Maddy. He decides to quit the turbulent and demanding life of thrill for Maddy's sake and retires to a small town. His daughter fights off a boy who was bullying her at school and this sets in motion a round of events that end in his direct confrontation with the local Meth drug lord. His past history with the biker gang also enters the arena, making matters more complex. But he has a mission in his mind to protect his daughter and he is ready to pay any cost that it demands.","['Jason Statham', 'James Franco', 'Izabela Vidovic']"
"['Drama', 'Music']",175541,Black Nativity,"A street-wise teen from Baltimore who has been raised by a single mother travels to New York City to spend the Christmas holiday with his estranged relatives, where he embarks on a surprising and inspirational journey.","['Forest Whitaker', 'Angela Bassett', 'Jennifer Hudson']"
"['Drama', 'Family']",226354,The Christmas Candle,"Deep in the heart of the English countryside lies the enchanting village of Gladbury. Legend has it every 25 years an angel visits the village candlemaker and touches a single candle. Whoever lights this candle receives a miracle on Christmas Eve. But in 1890, at the dawn of the electric age, this centuries old legend may come to an end.","['Hans Matheson', 'Samantha Barks', 'Lesley Manville']"
"['Documentary', 'Drama']",211086,Faith Connections,A filmmaker's insight into the biggest gathering on earth -the Kumbh Mela.,"['Bhole Baba', 'Hatha Yogi Baba', 'Pant Shirt Baba']"
