genres,movie_id,original_title,plot,cast
"['Science Fiction', 'Comedy']",312793,Walking with the Dead,"THE WALKING DECEASED is the Scary Movie of the zombie genre, ripping on the biggest and best of zombie pop-culture, arguably the most crazed genre in the world. The story follows a group of survivors from all walks of the apocalypse – an idiotic Sheriff with definite coma-induced brain damage, his hardass son and a hobo with only a crossbow to stave off the walking dead, four squabbling friends forced to survive this zombieland together, and a lonely zombie who just needs love to fully regain his warm body – who leave their once-safe mall hideout in search of the rumored Safe Haven Ranch, a refuge untouched by the zombie virus that has ravaged humanity. But despite the comforting name, they discover that this sanctuary may not be as welcoming as advertised.","['Tim Ogletree', 'Troy Ogletree', 'Dave Sheridan']"
"['Comedy', 'Drama', 'Music']",256924,Danny Collins,An ageing rock star decides to change his life when he discovers a 40-year-old letter written to him by John Lennon.,"['Al Pacino', 'Annette Bening', 'Jennifer Garner']"
"['Fantasy', 'Comedy', 'Animation']",228161,Home,"When Earth is taken over by the overly-confident Boov, an alien race in search of a new place to call home, all humans are promptly relocated, while all Boov get busy reorganizing the planet. But when one resourceful girl, Tip, manages to avoid capture, she finds herself the accidental accomplice of a banished Boov named Oh. The two fugitives realize there’s a lot more at stake than intergalactic relations as they embark on the road trip of a lifetime.","['Jim Parsons', 'Rihanna', 'Steve Martin']"
"['Adventure', 'Science Fiction', 'Thriller']",262500,Insurgent,Beatrice Prior must confront her inner demons and continue her fight against a powerful alliance which threatens to tear her society apart.,"['Shailene Woodley', 'Theo James', 'Kate Winslet']"
"['Crime', 'Thriller']",181283,Child 44,"Set in Stalin-era Soviet Union, a disgraced MGB agent is dispatched to investigate a series of child murders -- a case that begins to connect with the very top of party leadership.","['Tom Hardy', 'Gary Oldman', 'Noomi Rapace']"
"['Thriller', 'Mystery', 'Drama']",319910,Broken Horses,"The bonds of brotherhood, the laws of loyalty, and the futility of violence in the shadows of the US Mexico border gang wars.","['María Valverde', ""Vincent D'Onofrio"", 'Thomas Jane']"
"['Drama', 'Music']",75861,To Write Love on Her Arms,"The story follows 19-year-old Renee who has always loved fairy tales: the idea of a princess, a hero and a happily ever after. But Renee’s life is that of a darker tale: she’s a young woman battling addiction, depression and self-injury. In a creative blend of artistic fantasy balanced with harsh reality, the movie follows Renee on her courageous journey towards recovery.","['Kat Dennings', 'Chad Michael Murray', 'Rupert Friend']"
"['Drama', 'Comedy']",323967,Walter,A ticket-taker at the local cinema believes he is the son of God. He has agreed to decide the eternal fate of everyone he comes in to contact with.,"['Andrew J. West', 'Justin Kirk', 'Virginia Madsen']"
"['Romance', 'Fantasy', 'Family']",150689,Cinderella,"When her father unexpectedly passes away, young Ella finds herself at the mercy of her cruel stepmother and her daughters. Never one to give up hope, Ella's fortunes begin to change after meeting a dashing stranger in the woods.","['Lily James', 'Cate Blanchett', 'Richard Madden']"
"['Action', 'Crime', 'Drama']",241554,Run All Night,"Brooklyn mobster and prolific hit man Jimmy Conlon has seen better days. Longtime best friend of a mob boss, Jimmy is haunted by the sins of his past—as well as a dogged police detective who’s been one step behind Jimmy for 30 years. But when Jimmy’s estranged son becomes a target, Jimmy must make a choice between the crime family he chose and the real family he abandoned long ago. Now, with nowhere safe to turn, Jimmy has just one night to figure out exactly where his loyalties lie and to see if he can finally make things right.","['Liam Neeson', 'Ed Harris', 'Joel Kinnaman']"
"['Action', 'Thriller', 'Mystery']",322194,Subconscious,An investigation into a retired WWII sub plunges a research team into a supernatural journey across the dark abyss of time - with history hanging in the balance.,"['Tim Abell', 'Naomi Brockwell', 'Aleisha Force']"
['Horror'],325123,Teeth and Blood,"A beautiful diva is murdered on the set of horror director Vincent Augustine's latest film ""Chapel Blood."" Somewhere between the crime scene and the coroner's van, the body mysteriously disappears. Meanwhile, the city's supply of donated blood is being dangerously depleted. Suspecting a connection between the events, detectives Mike Hung and Sasha Colfax go undercover at the studio to investigate. Their attempt to crack the case quickly turns into a desperate battle for survival when they uncover an age-old war between rival vampire covens that threatens to consume humanity in a final, grisly assault of Teeth and Blood!","['Glenn Plummer', 'Michelle Van Der Water', 'Danielle Vega']"
['Comedy'],291362,Road Hard,"After his movie and television career has run dry, Bruce Madsen (Adam Carolla) is forced to go back on the road playing one dingy comedy club after another, spending endless nights in budget hotel rooms and always flying coach. Amidst trying to revitalize his career, rekindle his love life and put his daughter through college, Bruce knows one thing for sure - he must get off the road. ROAD HARD is the story of that journey.","['Adam Carolla', 'Diane Farr', 'Larry Miller']"
['Comedy'],239573,Unfinished Business,"A hard-working small business owner and his two associates travel to Europe to close the most important deal of their lives.  But what began as a routine business trip goes off the rails in every imaginable – and unimaginable – way, including unplanned stops at a massive sex fetish event and a global economic summit.","['Vince Vaughn', 'Dave Franco', 'James Marsden']"
"['Crime', 'Action', 'Science Fiction']",198184,Chappie,"Every child comes into the world full of promise, and none more so than Chappie: he is gifted, special, a prodigy. Like any child, Chappie will come under the influence of his surroundings—some good, some bad—and he will rely on his heart and soul to find his way in the world and become his own man. But there's one thing that makes Chappie different from any one else: he is a robot.","['Sharlto Copley', 'Dev Patel', 'Ninja']"
"['Action', 'Horror', 'Thriller']",244316,Into the Grizzly Maze,Two estranged brothers reunite at their childhood home in the Alaskan wild. They set out on a two-day hike and are stalked by an unrelenting grizzly bear.,"['James Marsden', 'Thomas Jane', 'Piper Perabo']"
"['Adventure', 'Drama', 'Western']",322443,The Timber,"In the wild west, two brothers embark on a journey to collect a bounty in a desperate attempt to save their home: but what they find along the way is more than they bargained for.","['James Ransone', 'Elisa Lasowski', 'Josh Peck']"
"['Drama', 'Comedy']",268238,The Second Best Exotic Marigold Hotel,As the Best Exotic Marigold Hotel has only a single remaining vacancy - posing a rooming predicament for two fresh arrivals - Sonny pursues his expansionist dream of opening a second hotel.,"['Dev Patel', 'Judi Dench', 'Richard Gere']"
"['Romance', 'Comedy', 'Crime']",256591,Focus,"Nicky, a veteran con artist, takes a novice named Jess under his wing. While Nicky teaches Jess the tricks of the trade, the pair become romantically involved; but, when Jess gets uncomfortably close, Nicky ends their relationship. Three years later, Nicky is in Buenos Aires working a very dangerous scheme when Jess -- now an accomplished femme fatale -- unexpectedly shows up. Her appearance throws Nicky for a loop at a time when he cannot afford to be off his game.","['Will Smith', 'Margot Robbie', 'Rodrigo Santoro']"
['Drama'],228203,"McFarland, USA",A track coach in a small California town transforms a team of athletes into championship contenders.,"['Kevin Costner', 'Ramiro Rodriguez', 'Carlos Pratts']"
['Comedy'],243938,Hot Tub Time Machine 2,"When Lou, who has become the ""father of the Internet,"" is shot by an unknown assailant, Jacob and Nick fire up the time machine again to save their friend.","['Rob Corddry', 'Craig Robinson', 'Clark Duke']"
"['Romance', 'Comedy']",272693,The DUFF,"Bianca's universe turns upside down when she learns that her high school refers to her as a ‘DUFF' (Designated Ugly Fat Friend). Hoping to erase that label, she enlists the help of a charming jock and her favorite teacher. Together they'll face the school's mean girl and remind everyone that we are all someone's DUFF… and that's totally fine.","['Mae Whitman', 'Robbie Amell', 'Bella Thorne']"
"['Action', 'Drama', 'Adventure']",300168,天將雄師,"Huo An, the commander of the Protection Squad of the Western Regions, was framed by evil forces and becomes enslaved. On the other hand, a Roman general escapes to China after rescuing the Prince. The heroic duo meet in the Western Desert and a thrilling story unfolds.","['Jackie Chan', 'John Cusack', 'Adrien Brody']"
"['Action', 'Drama', 'Crime']",266396,The Gunman,"Eight years after fleeing the Congo following his assassination of that country's minister of mining, former assassin Jim Terrier is back, suffering from PTSD and digging wells to atone for his violent past. After an attempt is made on his life, Terrier flies to London to find out who wants him dead -- and why. Terrier's search leads him to a reunion with Annie, a woman he once loved, who is now married to an oily businessman with dealings in Africa.","['Sean Penn', 'Jasmine Trinca', 'Javier Bardem']"
"['Action', 'Adventure', 'Science Fiction']",79698,The Lovers,"The Lovers is an epic romance time travel adventure film. Helmed by Roland Joffé from a story by Ajey Jhankar, the film is a sweeping tale of an impossible love set against the backdrop of the first Anglo-Maratha war across two time periods and continents and centred around four characters — a British officer in 18th century colonial India, the Indian woman he falls deeply in love with, an American present-day marine biologist and his wife.","['Josh Hartnett', 'Simone Kessell', 'Tamsin Egerton']"
"['Thriller', 'Horror']",234212,Demonic,A police officer and a psychologist investigate the deaths of five people who were killed while trying to summon ghosts.,"['Maria Bello', 'Frank Grillo', 'Cody Horn']"
"['Drama', 'Romance', 'Thriller']",216015,Fifty Shades of Grey,"When college senior Anastasia Steele steps in for her sick roommate to interview prominent businessman Christian Grey for their campus paper, little does she realize the path her life will take. Christian, as enigmatic as he is rich and powerful, finds himself strangely drawn to Ana, and she to him. Though sexually inexperienced, Ana plunges headlong into an affair -- and learns that Christian's true sexual proclivities push the boundaries of pain and pleasure.","['Dakota Johnson', 'Jamie Dornan', 'Jennifer Ehle']"
"['Romance', 'Comedy']",316002,Accidental Love,"A small town waitress gets a nail accidentally lodged in her head causing unpredictable behavior that leads her to Washington, DC.  Sparks fly when she meets a clueless young senator who takes up her cause - but what happens when love interferes with what you stand for?","['Jake Gyllenhaal', 'Jessica Biel', 'James Marsden']"
['Documentary'],322745,Counting,"An associative collection of visual impressions across fifteen chapters: a seagull in Porto, political posters in New York, an abstract painting in St. Petersburg, an abandoned video shop in Cairo and cats everywhere you look.",[]
['Drama'],310569,Que Horas Ela Volta?,"After leaving her daughter Jessica in a small town in Pernambuco to be raised by relatives, Val spends the next 13 years working as a nanny to Fabinho in São Paulo. She has financial stability but has to live with the guilt of having not raised Jessica herself. As Fabinho’s university entrance exams approach, Jessica reappears in her life and seems to want to give her mother a second chance. However Jessica has not been raised to be a servant and her very existence will turn Val’s routine on its head. With precision and humour, Anna Muylaert turns her eye on the subtle and powerful forces that keep rigid class structures in place and how the youth may just be the ones to shake it all up.","['Regina Casé', 'Michel Joelsas', 'Camila Márdila']"
"['Drama', 'Romance']",318040,Bizarre,"Maurice, a reticent young homeless man, somehow manages to get by in Brooklyn; he spends his nights in parked cars until he finds himself at Bizarre, an underground club renowned for its burlesque shows. Maurice is fascinated by the club’s playful revues celebrating self-determined sexuality and creative otherness, and the two female club owners both adore him. He soon becomes a part of their self-selected family, and begins to bond with introverted Luka. But Maurice turns his back on Luka’s growing affection. Running away from his true emotions he drifts aimlessly through the city. He tries to find his feet at a boxing club, where he meets Charlie. Unable to withstand the pressure of his repressed feelings, Maurice unleashes a mounting foment of emotions, pervaded by tenderness and menace.","['Pierre Prieur', 'Adrian James', 'Raquel Nave']"
"['Animation', 'Adventure', 'Comedy']",228165,The SpongeBob Movie: Sponge Out of Water,"Burger Beard is a pirate who is in search of the final page of a magical book that makes any evil plan he writes in it come true, which happens to be the Krabby Patty secret formula. When the entire city of Bikini Bottom is put in danger, SpongeBob, Patrick, Mr. Krabs, Squidward, Sandy, and Plankton need to go on a quest that takes them to the surface. In order to get back the recipe and save their city, the gang must retrieve the book and transform themselves into superheroes.","['Tom Kenny', 'Bill Fagerbakke', 'Rodger Bumpass']"
"['Science Fiction', 'Fantasy', 'Action']",76757,Jupiter Ascending,"In a universe where human genetic material is the most precious commodity, an impoverished young Earth woman becomes the key to strategic maneuvers and internal strife within a powerful dynasty…","['Mila Kunis', 'Channing Tatum', 'Sean Bean']"
"['Horror', 'Thriller']",270303,It Follows,"For 19-year-old Jay, fall should be about school, boys and weekends out at the lake. But a seemingly innocent physical encounter turns sour and gives her the inescapable sense that someone, or something, is following her. Faced with this burden, Jay and her teenage friends must find a way to escape the horror that seems to be only a few steps behind.","['Maika Monroe', 'Keir Gilchrist', 'Daniel Zovatto']"
"['Science Fiction', 'Thriller']",227719,Project Almanac,"A group of teens discover secret plans of a time machine, and construct one. However, things start to get out of control.","['Jonny Weston', 'Virginia Gardner', ""Sofia Black-D'Elia""]"
"['Thriller', 'Horror']",243940,The Lazarus Effect,"Medical researcher Frank, his fiancee Zoe and their team have achieved the impossible: they have found a way to revive the dead. After a successful, but unsanctioned, experiment on a lifeless animal, they are ready to make their work public. However, when their dean learns what they've done, he shuts them down. Zoe is killed during an attempt to recreate the experiment, leading Frank to test the process on her. Zoe is revived -- but something evil is within her.","['Olivia Wilde', 'Mark Duplass', 'Donald Glover']"
"['History', 'Documentary']",319069,Censored Voices,"The 1967 'Six-Day' war ended with Israel's decisive victory; conquering Jerusalem, Gaza, Sinai and the West Bank. It is a war portrayed, to this day, as a righteous undertaking - a radiant emblem of Jewish pride. One week after the war, a group of young kibbutzniks, led by renowned author Amos Oz, recorded intimate conversations with soldiers returning from the battlefield. The recording revealed an honest look at the moment Israel turned from David to Goliath. The Israeli army censored the recordings, allowing the kibbutzniks to publish only a fragment of the conversations. 'Censored Voices' reveals the original recordings for the first time.",['Amos Oz']
['Thriller'],241251,The Boy Next Door,"A recently cheated on married woman falls for a younger man who has moved in next door, but their torrid affair soon takes a dangerous turn.","['Jennifer Lopez', 'Ryan Guzman', 'Ian Nelson']"
"['Comedy', 'Adventure']",210860,Mortdecai,"Art dealer, Charles Mortdecai, searches for a stolen painting rumored to contain a secret code that gains access to hidden Nazi gold.","['Johnny Depp', 'Gwyneth Paltrow', 'Ewan McGregor']"
"['Drama', 'Science Fiction']",264660,Ex Machina,"Caleb, a 26 year old coder at the world's largest internet company, wins a competition to spend a week at a private mountain retreat belonging to Nathan, the reclusive CEO of the company. But when Caleb arrives at the remote location he finds that he will have to participate in a strange and fascinating experiment in which he must interact with the world's first true artificial intelligence, housed in the body of a beautiful robot girl.","['Domhnall Gleeson', 'Alicia Vikander', 'Oscar Isaac']"
"['Thriller', 'Horror']",226458,Backmask,"During an all-night, drug-fueled party at an abandoned asylum known for the horrific treatment of its patients, a group of ordinary teens decide to experiment with the occult, mysteriously leading to a violent possession. In an effort to find help, the group rushes to escape, only to find themselves locked inside with no means of communication. Tempers flare, trusts are broken and in attempt to save one of their friends possessed by the demon, the amateurs try to perform an exorcism. Instead of solving the problem, and unbeknownst to them, they unleash an even more powerful and vengeful spirit, one with a distinct motive and which wants them all dead. The teen's only chance of survival is to uncover the asylum's deep mysteries and find a way out before it's too late.","['Stephen Lang', 'Kelly Blatz', 'Brittany Curran']"
"['Thriller', 'Crime', 'Drama']",265208,Wild Card,"When a Las Vegas bodyguard with lethal skills and a gambling problem gets in trouble with the mob, he has one last play… and it's all or nothing.","['Jason Statham', 'Michael Angarano', 'Milo Ventimiglia']"
"['Crime', 'Drama', 'Mystery']",201088,Blackhat,A man is released from prison to help American and Chinese authorities pursue a mysterious cyber criminal. The dangerous search leads them from Chicago to Hong Kong.,"['Chris Hemsworth', 'Leehom Wang', 'Tang Wei']"
"['Family', 'Drama']",306667,Horse Camp,"What’s the matter with Kathy (Jordan Trovillion, Highland Park)? She’s your typical 17 year-old girl in search of something more in her life. It seems the only place she is going to find it is at Horse Camp. Her father Luke (Dean Cain, Lois &amp; Clark: The New Adventures of Superman) recognizes that she’s got it in her blood, a sensibility in her being - she understands horses just as much as they understand her. But at Horse Camp there is much more to learn, not only about horses, but about people and the many challenges of friendship.","['Jordan Trovillion', 'Dean Cain', 'Sherryl Despres']"
[],371085,Sharkskin,"The Post War II story of Manhattan born Mike Esposito, a practiced tailor of custom mens clothing; a man of dignity and honor, whose developing involvements with the Italian mob wraps him up in a world of moral dilemma and clashing values.",[]
[],325579,Diamond Ruff,"Action - Orphan, con artist, crime boss and millionaire, Diamond Ruff has seen it all. In prison for a murder he did not commit, he meets the Reverend Trek Woods, who overwhelms him with kindness, character and faith in god. Falling in love with April, a young woman with terminal illness, Ruff is again challenged to grow and change. Will he be redeemed? There are no easy answers. -  Felicia Pearson, Fredro Starr, Michael Barra",[]
[],176074,Reality Show,"The Warwick family are unknowingly being filmed for a new reality show. Problem is, they're boring. So the producer must add conflict and drama to their lives. Their lives begin to unravel with shocking consequences.","['Adam Rifkin', 'Kelley Menighan Hensley', 'Kendra Sue Waldman']"
"['Crime', 'Drama', 'Thriller']",241239,A Most Violent Year,"A thriller set in New York City during the winter of 1981, statistically one of the most violent years in the city's history, and centered on a the lives of an immigrant and his family trying to expand their business and capitalize on opportunities as the rampant violence, decay, and corruption of the day drag them in and threaten to destroy all they have built.","['Oscar Isaac', 'Jessica Chastain', 'Albert Brooks']"
"['Drama', 'War']",227306,Unbroken,"A chronicle of the life of Louis Zamperini, an Olympic runner who was taken prisoner by Japanese forces during World War II.","[""Jack O'Connell"", 'Domhnall Gleeson', 'Garrett Hedlund']"
"['Fantasy', 'Comedy', 'Music']",224141,Into the Woods,"In a woods filled with magic and fairy tale characters, a baker and his wife set out to end the curse put on them by their neighbor, a spiteful witch.","['Meryl Streep', 'Emily Blunt', 'James Corden']"
"['Action', 'Comedy']",228967,The Interview,"Dave Skylark and his producer Aaron Rapoport run the celebrity tabloid show ""Skylark Tonight"". When they land an interview with a surprise fan, North Korean dictator Kim Jong-un, they are recruited by the CIA to turn their trip to Pyongyang into an assassination mission.","['James Franco', 'Seth Rogen', 'Lizzy Caplan']"
"['Thriller', 'Crime', 'Drama']",284536,The Gambler,"Literature professor Jim Bennett leads a secret life as a high-stakes gambler. Always a risk-taker, Bennett bets it all when he borrows from a gangster and offers his own life as collateral. Staying one step ahead, he pits his creditor against the operator of an illicit gambling ring while garnering the attention of Frank, a paternalistic loan shark. As his relationship with a student deepens, Bennett must risk everything for a second chance.","['Mark Wahlberg', 'John Goodman', 'Brie Larson']"
"['War', 'Drama']",256917,The Water Diviner,"In 1919, Australian farmer Joshua Connor travels to Turkey to discover the fate of his three sons, reported missing in action. Holding on to hope, Joshua must travel across the war-torn landscape to find the truth and his own peace.","['Russell Crowe', 'Olga Kurylenko', 'Yılmaz Erdoğan']"
"['History', 'Drama']",273895,Selma,"Selma, as in Alabama, the place where segregation in the South was at its worst, leading to a march that ended in violence, forcing a famous statement by President Lyndon B. Johnson that ultimately led to the signing of the Civil Rights Act.","['David Oyelowo', 'Tom Wilkinson', 'Carmen Ejogo']"
"['Comedy', 'Romance', 'Crime']",171274,Inherent Vice,"In Los Angeles at the turn of the 1970s, drug-fueled detective Larry ""Doc"" Sportello investigates the disappearance of an ex-girlfriend.","['Joaquin Phoenix', 'Josh Brolin', 'Owen Wilson']"
['Drama'],87093,Big Eyes,"The story of the awakening of the painter, Margaret Keane, her phenomenal success in the 1950s, and the subsequent legal difficulties she had with her husband, who claimed credit for her works in the 1960s.","['Amy Adams', 'Christoph Waltz', 'Krysten Ritter']"
['Comedy'],300706,Let's Kill Ward's Wife,"Everyone hates Ward’s wife and wants her dead, Ward (Donald Faison) most of all. But when his friends’ murderous fantasies turn into an (accidental) reality, they have to deal with a whole new set of problems — like how to dispose of the body and still make their 3 p.m. tee time. Scott Foley's directorial debut, also starring Foley, Patrick Wilson, Amy Acker, and Nicolette Sheridan, is a blackly comic caper about helping a friend out of a bad relationship by any means necessary.","['Patrick Wilson', 'Scott Foley', 'Amy Acker']"
"['Comedy', 'Drama', 'Family']",196867,Annie,"Ever since her parents left her as a baby, little Annie has led a hard-knock life with her calculating foster mother, Miss Hannigan. However, all that changes when hard-nosed billionaire and mayoral candidate Will Stacks takes her in on the recommendation of his advisers. Stacks believes that he's Annie's guardian angel, but the plucky youngster's confidence and sunny outlook may mean that Annie will save Will instead.","['Quvenzhané Wallis', 'Jamie Foxx', 'Rose Byrne']"
"['Adventure', 'Comedy', 'Fantasy']",181533,Night at the Museum: Secret of the Tomb,"When the magic powers of The Tablet of Ahkmenrah begin to die out, Larry Daley (Ben Stiller) spans the globe, uniting favorite and new characters while embarking on an epic quest to save the magic before it is gone forever.","['Ben Stiller', 'Rami Malek', 'Rebel Wilson']"
"['Comedy', 'Drama', 'Music']",304410,La Famille Bélier,"The whole Bélier family is deaf, except for sixteen year old Paula who is the important translator in her parents' day to day life especially when it comes to matters concerning the family farm. When her music teacher discovers she has a fantastic singing voice and she gets an opportunity to enter a big Radio France contest the whole family's future is set up for big changes.","['Louane Emera', 'Karin Viard', 'François Damiens']"
"['Thriller', 'Action']",260346,Taken 3,"Ex-government operative Bryan Mills finds his life is shattered when he's falsely accused of a murder that hits close to home. As he's pursued by a savvy police inspector, Mills employs his particular set of skills to track the real killer and exact his unique brand of justice.","['Liam Neeson', 'Forest Whitaker', 'Maggie Grace']"
